{
  "$schema": "https://json-schema.org/draft/2020-12/schema",
  "$id": "https://tattoo.local/schemas/studio-job.schema.json",
  "title": "StudioJob",
  "type": "object",
  "additionalProperties": false,
  "required": [
    "brief",
    "referenceIds",
    "idempotencyKey",
    "referencesReviewed"
  ],
  "properties": {
    "brief": {
      "description": "The system's central contract. The consultation produces it; the flash, stencil and mockup engines consume it. Size is authoritative in millimetres (CONTRACTS-INV-001) and style is drawn from a closed vocabulary (CONTRACTS-INV-002). No 'format' keyword is used and every pattern spells out [0-9], so that TypeScript and Python reach identical verdicts.",
      "type": "object",
      "additionalProperties": false,
      "required": [
        "schemaVersion",
        "briefId",
        "revision",
        "createdAt",
        "subject",
        "style",
        "linework",
        "shading",
        "colour",
        "placement",
        "size"
      ],
      "properties": {
        "schemaVersion": {
          "description": "Fixed for this schema revision. A breaking change bumps it and carries a migration (CONTRACTS-INV-004).",
          "const": "1.0.0"
        },
        "briefId": {
          "description": "Canonical lowercase UUID. Uses a pattern rather than 'format' so both runtimes assert it.",
          "type": "string",
          "pattern": "^[0-9a-f]{8}-[0-9a-f]{4}-[1-8][0-9a-f]{3}-[89ab][0-9a-f]{3}-[0-9a-f]{12}$"
        },
        "revision": {
          "description": "Increments on every accepted change. A Design records the revision that produced it (CONTRACTS-INV-003).",
          "type": "integer",
          "minimum": 1
        },
        "createdAt": {
          "description": "RFC 3339 timestamp. ASCII digits only, so Python and JavaScript agree.",
          "type": "string",
          "pattern": "^[0-9]{4}-[0-9]{2}-[0-9]{2}T[0-9]{2}:[0-9]{2}:[0-9]{2}([.][0-9]+)?(Z|[+-][0-9]{2}:[0-9]{2})$"
        },
        "subject": {
          "description": "What the tattoo depicts.",
          "type": "object",
          "additionalProperties": false,
          "required": [
            "description"
          ],
          "properties": {
            "description": {
              "type": "string",
              "minLength": 10,
              "maxLength": 2000
            },
            "elements": {
              "description": "Key motifs, kept structured so engines can weight them individually.",
              "type": "array",
              "items": {
                "type": "string",
                "minLength": 1,
                "maxLength": 120
              },
              "maxItems": 20,
              "uniqueItems": true
            }
          }
        },
        "style": {
          "type": "object",
          "additionalProperties": false,
          "required": [
            "primary"
          ],
          "properties": {
            "primary": {
              "$ref": "#/$defs/styleName"
            },
            "secondary": {
              "$ref": "#/$defs/styleName"
            },
            "notes": {
              "description": "Free text for nuance within a style. Never a route around the closed vocabulary, and never a place to name a living artist (PROD-INV-004, enforced by the safety module).",
              "type": "string",
              "maxLength": 600
            }
          }
        },
        "linework": {
          "type": "object",
          "additionalProperties": false,
          "required": [
            "weight"
          ],
          "properties": {
            "weight": {
              "description": "Drives the stencil's single-weight linework as much as the flash render.",
              "enum": [
                "fine",
                "medium",
                "bold",
                "mixed"
              ]
            },
            "notes": {
              "type": "string",
              "maxLength": 400
            }
          }
        },
        "shading": {
          "type": "object",
          "additionalProperties": false,
          "required": [
            "technique",
            "intensity"
          ],
          "properties": {
            "technique": {
              "enum": [
                "none",
                "whip",
                "dotwork",
                "smooth_blend",
                "solid_fill",
                "mixed"
              ]
            },
            "intensity": {
              "enum": [
                "light",
                "medium",
                "heavy"
              ]
            }
          }
        },
        "colour": {
          "type": "object",
          "additionalProperties": false,
          "required": [
            "mode"
          ],
          "properties": {
            "mode": {
              "enum": [
                "black_and_grey",
                "colour",
                "black_and_grey_with_accent"
              ]
            },
            "palette": {
              "description": "Optional client colour preferences. Omit to leave colour selection to the design process using the idea and reviewed references. Forbidden for pure black-and-grey.",
              "type": "array",
              "items": {
                "type": "string",
                "minLength": 1,
                "maxLength": 40
              },
              "minItems": 1,
              "maxItems": 8,
              "uniqueItems": true
            }
          },
          "allOf": [
            {
              "description": "A black-and-grey brief cannot carry a palette. This conditional is why validation runs through the schema in both runtimes rather than through generated models, which cannot express it.",
              "if": {
                "properties": {
                  "mode": {
                    "const": "black_and_grey"
                  }
                },
                "required": [
                  "mode"
                ]
              },
              "then": {
                "not": {
                  "required": [
                    "palette"
                  ]
                }
              }
            }
          ]
        },
        "placement": {
          "description": "Where on the body. Embedded rather than extracted into its own schema until a second consumer exists (TASK-0002/DEC-004).",
          "type": "object",
          "additionalProperties": false,
          "required": [
            "bodyPart",
            "orientation"
          ],
          "properties": {
            "bodyPart": {
              "$ref": "#/$defs/bodyPart"
            },
            "orientation": {
              "enum": [
                "vertical",
                "horizontal",
                "diagonal",
                "wrapping"
              ]
            },
            "side": {
              "enum": [
                "left",
                "right",
                "centre"
              ]
            },
            "bodyType": {
              "description": "Presented sex of the generated skin plate, so a calf reads as a man's or a woman's (TASK-0041). It never reaches the artwork prompt, only the background. Absent when an own photograph is the surface.",
              "enum": [
                "masculine",
                "feminine"
              ]
            }
          }
        },
        "size": {
          "description": "Millimetres are authoritative. No pixel dimension appears anywhere in this contract (CONTRACTS-INV-001).",
          "type": "object",
          "additionalProperties": false,
          "required": [
            "widthMm",
            "heightMm"
          ],
          "properties": {
            "widthMm": {
              "$ref": "#/$defs/millimetres"
            },
            "heightMm": {
              "$ref": "#/$defs/millimetres"
            }
          }
        },
        "constraints": {
          "type": "object",
          "additionalProperties": false,
          "properties": {
            "coverUp": {
              "description": "Covering existing work constrains density and darkness heavily.",
              "type": "boolean"
            },
            "avoid": {
              "type": "array",
              "items": {
                "type": "string",
                "minLength": 1,
                "maxLength": 120
              },
              "maxItems": 20,
              "uniqueItems": true
            }
          }
        }
      }
    },
    "referenceIds": {
      "description": "TASK-0058 (ADR-0026): may be empty. A generic idea is drawn from the brief alone; the consultation still blocks on a missing essential reference (a named emblem, flag, landmark or artwork).",
      "type": "array",
      "minItems": 0,
      "maxItems": 5,
      "uniqueItems": true,
      "items": {
        "type": "string",
        "pattern": "^[a-f0-9]{32}$"
      }
    },
    "bodyPhotoId": {
      "type": "string",
      "pattern": "^[a-f0-9]{32}$"
    },
    "idempotencyKey": {
      "type": "string",
      "pattern": "^[a-f0-9-]{36}$"
    },
    "referencesReviewed": {
      "const": true
    },
    "placement": {
      "type": "object",
      "additionalProperties": false,
      "required": [
        "x",
        "y",
        "width"
      ],
      "properties": {
        "x": {
          "type": "number",
          "minimum": 0,
          "maximum": 1
        },
        "y": {
          "type": "number",
          "minimum": 0,
          "maximum": 1
        },
        "width": {
          "type": "number",
          "exclusiveMinimum": 0,
          "maximum": 1
        },
        "photoWidthMm": {
          "type": "number",
          "minimum": 20,
          "maximum": 3000
        }
      }
    },
    "edit": {
      "type": "object",
      "additionalProperties": false,
      "required": [
        "parentJobId",
        "instruction"
      ],
      "properties": {
        "parentJobId": {
          "type": "string",
          "pattern": "^[a-f0-9]{32}$"
        },
        "instruction": {
          "type": "string",
          "minLength": 3,
          "maxLength": 1000,
          "pattern": "\\S"
        },
        "referenceIds": {
          "description": "TASK-0036: reference images the client attached to this change request, already screened and owned. They guide the edit and join the design's references.",
          "type": "array",
          "minItems": 1,
          "maxItems": 3,
          "uniqueItems": true,
          "items": {
            "type": "string",
            "pattern": "^[a-f0-9]{32}$"
          }
        },
        "coverage": {
          "enum": [
            "larger",
            "smaller",
            "full"
          ]
        },
        "mode": {
          "enum": [
            "artwork",
            "placement"
          ]
        }
      }
    }
  },
  "$defs": {
    "styleName": {
      "description": "Curated anatomical placements' counterpart for style. Closed vocabulary: free-text style requests are mapped onto it, and anything unmapped prompts a clarifying question rather than passing through raw (CONSULT-INV-003). Extended by TASK-0027 (ADR-0011) with six styles clients ask for that were previously rejected; `tribal` was the repository's own example of an out-of-vocabulary style.",
      "enum": [
        "american_traditional",
        "fine_line",
        "black_and_grey_realism",
        "neo_traditional",
        "irezumi",
        "blackwork",
        "illustrative",
        "ornamental",
        "lettering",
        "surrealism",
        "tribal",
        "geometric",
        "watercolour",
        "new_school",
        "chicano",
        "biomechanical"
      ]
    },
    "bodyPart": {
      "description": "Curated anatomical placements. Several of these are torso areas whose reference photographs are sensitive personal data; see quality-and-security.spec.md.",
      "enum": [
        "inner_forearm",
        "outer_forearm",
        "upper_arm_inner",
        "upper_arm_outer",
        "shoulder",
        "collarbone",
        "chest",
        "sternum",
        "ribs",
        "stomach",
        "upper_back",
        "lower_back",
        "spine",
        "hip",
        "thigh_front",
        "thigh_outer",
        "calf",
        "shin",
        "ankle",
        "foot",
        "wrist_inner",
        "wrist_outer",
        "hand",
        "finger",
        "neck",
        "behind_ear"
      ]
    },
    "millimetres": {
      "description": "Bounded to what is physically plausible: smaller than 5mm will not hold detail, larger than 600mm exceeds a single sitting's placement.",
      "type": "number",
      "minimum": 5,
      "maximum": 600
    }
  }
}
