{
  "brief": {
    "schemaVersion": "1.0.0",
    "briefId": "0a1b2c3d-4e5f-4a6b-8c9d-0e1f2a3b4c5d",
    "revision": 1,
    "createdAt": "2026-01-02T03:04:05Z",
    "subject": {
      "description": "A biomechanical panel on the right thigh."
    },
    "style": {
      "primary": "biomechanical"
    },
    "linework": {
      "weight": "fine"
    },
    "shading": {
      "technique": "none",
      "intensity": "light"
    },
    "colour": {
      "mode": "black_and_grey_with_accent"
    },
    "placement": {
      "bodyPart": "thigh_front",
      "orientation": "vertical",
      "side": "right"
    },
    "size": {
      "widthMm": 129,
      "heightMm": 272
    }
  },
  "referenceIds": [
    "aaaaaaaaaaaaaaaaaaaaaaaaaaaaaaaa"
  ],
  "idempotencyKey": "11111111-1111-4111-8111-111111111111",
  "referencesReviewed": true
}
