{
  "brief": {
    "schemaVersion": "1.0.0",
    "briefId": "0a1b2c3d-4e5f-4a6b-8c9d-0e1f2a3b4c5d",
    "revision": 1,
    "createdAt": "2026-01-02T03:04:05Z",
    "subject": {
      "description": "A single fine line mountain range."
    },
    "style": {
      "primary": "fine_line"
    },
    "linework": {
      "weight": "fine"
    },
    "shading": {
      "technique": "none",
      "intensity": "light"
    },
    "colour": {
      "mode": "black_and_grey"
    },
    "placement": {
      "bodyPart": "inner_forearm",
      "orientation": "horizontal"
    },
    "size": {
      "widthMm": 60,
      "heightMm": 20
    }
  },
  "referenceIds": [
    "aaaaaaaaaaaaaaaaaaaaaaaaaaaaaaaa"
  ],
  "idempotencyKey": "11111111-1111-4111-8111-111111111111",
  "referencesReviewed": true,
  "edit": {
    "parentJobId": "aaaaaaaaaaaaaaaaaaaaaaaaaaaaaaaa",
    "instruction": "Quiero una virgen como en la foto adjunta",
    "referenceIds": [
      "bbbbbbbbbbbbbbbbbbbbbbbbbbbbbbbb"
    ]
  }
}
